"Name","Company","City","State","Salary","Description","Url"
"Application Business Analyst","Shell","New Orleans","LA","$63k-$102k(Glassdoor Est.)","Job TitleApplication Business Analyst - New Orleans, LA15-Nov-201815-Dec-2018No. of Positions1Job DescriptionIT Business Analyst is responsible for identifying and documenting the business needs of their clients and stakeholders, and helping to determine feasible solutions to meet business needs or resolve business problems. This work is typically within a specific business area. The role may be part of an IT project development environment or an individual contributor at the business interface. This position will give you the opportunity to grow to become an active thought partner and solution visionary who shapes the technology demand and direction in the business community. This position has the following accountabilities:Precisely capture business problems, value drivers, and functional/non-functional requirements, including health, safety, security, usability, data, and supportability considerations. Translate business requirements into functionality and assess the risks, feasibility, opportunities, and business impacts of various solution options. Able to link technical solutions with business strategy when working with business partners.Broad and extensive knowledge, often in own specialized field, to provide interpretive, advisory or facilitating services for the use of others to achieve results.Assess and model processes, data flows, and technology to understand the current value and issues, and identify opportunities for improvement.Create clear documentation to communicate requirements and related information; keep updated to align with the solution over the project lifecycle.Ensure traceability of requirements from business needs and requirements, through testing and scope changes, to final solution. Interact with software suppliers, designers and developers to understand software limitations, deliver elements of system and database design, and ensure that business requirements and use cases are handled.Configure and document software and processes, using agreed standards and tools.Create acceptance criteria and validate that solutions meet business needs through defining and coordinating testing. Create and present compelling business cases to justify solution value and establish approval, funding and prioritization. Initiate, plan, execute, monitor, and control Business Analysis activities on projects within agreed parameters of cost, time and quality. Understand and stay abreast of relevant architectures and technologies related to a business area. Research potential solutions and innovative ideas. Guide and manage interactions with technology vendors.Has knowledge of how competitors are using IT solutions to gain competitive edge, applies that knowledge to projects.Participates in team efforts to create new best practice material based on identified gaps. Serves as an SME for specific tools, techniques, or business areas.Participates in industry IT BA related activities such as IIBA webcasts and/or chapter meetings and applies learnings within Shell including sharing of learnings.Respond to organizational and environmental changes during in-progress activities.Guide business stakeholders to gain acceptance / sign-off despite competing objectives. Manage requirements to the smallest set that will provide the biggest impact in advancing business objectives and end-user buy-in.Describe technology in terms easily understood by business customers and set realistic customer expectations for the project outcome. Adjust customer expectations in accordance with changes in scope.Generate innovative approaches to existing problems or new opportunities.Work closely with stakeholders to build trust and understand their goals, motivations, constraints, risks, and operating environment.Dimension:This role resides in the Upstream Deepwater (UPD) IT GoM Asset Systems Management delivery team, which is responsible for supporting the IT needs of the UPD Producing Assets in the Gulf of Mexico (GoM). The BA role is proximate to the business and would interface with the business to translate business needs into documented requirements that can easily be translated by others.The BA understands applications that are used within the business community and the business processes they support. As new global applications are introduced to UPD GoM, the BA would help to understand any gaps that exist between legacy applications and those new applications being introduced.Auto req ID93360BRCountry of Work LocationUnited States Company DescriptionShell is a global group of energy and petrochemicals companies with over 90,000 employees in more than 70 countries and territories. In the US, we have operated for over a century and are a major oil and gas producer onshore and in the Gulf of Mexico, a recognized innovator in exploration and production technology, and a leading manufacturer and marketer of fuels, natural gas and petrochemicals. We deliver energy responsibly; operate safely with respect to our neighbours and work to minimize our environmental impact. We are in search of remarkable people who will thrive in a diverse and inclusive work environment to deliver exciting projects locally and globally. People who are passionate about exploring new frontiers. Innovators and pioneers. People with the drive to help shape our future. Because remarkable people achieve remarkable things.Disclaimer Please note: We occasionally amend or withdraw Shell jobs and reserve the right to do so at any time, including prior to the advertised closing date.Before applying, you are advised to read our data protection policy. This policy describes the processing that may be associated with your personal data and informs you that your personal data may be transferred to Royal Dutch/Shell Group companies around the world.The Shell Group and its approved recruitment consultants will never ask you for a fee to process or consider your application for a career with Shell. Anyone who demands such a fee is not an authorised Shell representative and you are strongly advised to refuse any such demand.Shell participates in E-Verify.All qualified applicants will receive consideration for employment without regard to race, color, sex, national origin, age, religion, disability, sexual orientation, gender identity, protected veteran status, citizenship, genetic information or other protected status under federal, state or local laws.Shell is an Equal Opportunity Employer - Minorities/Females/Veterans/Disability.Work LocationNew OrleansRequirementsMust have legal authorization to work in the US on a full-time basis for anyone other than current employer.Bachelor's Degree. Degree related to Information Technology preferred.Minimum five (5) years’ corporate IT Business Analyst experience.Experience with evaluating, selecting, and implementing IT solutions including COTS, Market Standard, and SaaS is highly preferred.Expertise in specific Business Analysis techniques, tools, and business areas.Agile project experience.Proficient in the majority of the BA knowledge areas with understanding of systems engineering concepts and data/process analysis and modeling.Knowledge of the technology landscape including current and future developments and the most commonly available products and integrated solutions. Ability to take a systematic and analytical approach to problem solving and pay close attention to detail.Able to act as a focal point for a specialized area (technical or business); able to lead teams while managing multiple competing priorities.Demonstrates a concern and aptitude for considering the user’s perspective in IT development and has a deep understanding of user aspects of interactive systems.Experience analyzing the alignment between business requirements and system capabilities.Strong interpersonal and influencing skills.Ability to communicate concisely and clearly.CBAP (Certified Business Analysis Professional) or PMI-PBA certification preferred.Lean Practitioner training and experience are an asset.City, State (if applicable)New Orleans, LA","https://www.glassdoor.com/partner/jobListing.htm?pos=101&ao=370513&s=149&guid=0000016770013c4293a5e399b8533a7a&src=GD_JOB_AD&t=SRFJ&extid=4&exst=OL&ist=&ast=OL&vt=w&slr=true&rtp=0&cs=1_ec0472c4&cb=1543772389008&jobListingId=3026533234"
"Business Analyst II/Sr. Business Analyst - Cash Product Ofce","Federal Reserve Bank of Atlanta","New Orleans","LA","$64k-$104k(Glassdoor Est.)","Position Summary:Provides a broad range of services and activities that align analytical support and controls compliance with business initiatives and strategic goals. Will support District-wide compliance monitoring and training. May include database input and management; supporting data analysis and creation of dashboards and metric reports; MIS report and operations metrics production; and budget data input, management, and reporting. May conduct/coordinate internal improvement efforts and implementation plans; may either directly or indirectly lead small- to medium- size teams in these efforts. Conducts/coordinates the information flow among business lines to achieve desired outcomes. Key Responsibilities:Completes a range of analytical activities and exercises sound judgement to address problems or projects. Analyzes problems with appropriate logic and fact finding. Identifies irregularities or issues in work activities before major problems appear; organizes data and information in a manner that effectively communicates issues and underlying cause/effect relationships; performs intermediate level research and analysis; makes reliable conclusions from the analysis of available data details and/or trends and develops sound recommendations. Proactively identifies process improvement opportunities and brings them to management’s attention. Provides support in organizing District compliance activities such as peer reviews and post-audit reviews. Supports coordination of updates to Cash governing documentation such as procedure manual(s), COP documentation, and management audits, both annually and as needed. Strong teamwork and customer service orientation; Draws on experience to resolve moderately complex issues. Adheres to team guidelines and fulfills own responsibilities to accomplish team goals. Engages with team, all levels of management, and other stakeholders to collect feedback and input and complete work activities. Identifies critical activities and adjust priorities to prevent irrelevant issues and distractions from inhibiting completion of assignments. Prioritizes work assignment to ensure the most important work is completed first; coordinates work with others in group projects to support overall work plans and schedules. Brings competing priorities or issues to management’s attention for resolution. Where applicable, provides support for production systems, such as: maintaining daily processes, identifying problems, proposing alternatives, providing business application releases and customer testing. Produces written products that are clear, concise, grammatically correct and in a tone and format befitting the message, audience and objective of the writer. Verbally expresses thoughts and opinions to others in a clear and concise manner. Senior job title will require the following, higher level skills: Strong level of initiative and business acumen, advanced problem-solving skills, and ability to analyze moderately complex data sets and identify areas of improvement in support of an overall ""big picture"" strategy. Leads efforts to resolve issues/problems of moderate to complex scope, in which analysis of situations or data require a review of a variety of factors. Works on moderate to complex issues where analysis of situations and data requires an in-depth evaluation of factors. Normally receives little instruction on day-to-day work and general instructions on new assignments. Demonstrates flexibility to make adjustments as needed. Will be expected to acquire a robust understanding of core business functions within the department. Applies knowledge of and experience with team products, services and customers to efficiently and effectively document existing workflows and create new processes. Strong oral and written communication skills. May lead or assist in presentation or facilitation of effective training sessions/project updates/general communication to all levels of staff, management and senior management. May serve as a mentor to less-experienced staff for guidance on new projects or assignments. May lead high-performing teams, projects, or implementation plans for small- to medium-sized teams focused on meeting organizational objectives. Some exposure to District or System-level committees. Education:Bachelor's Degree or 4 years equivalent experience Experience:Business Analyst II - 2-5 years preferred Sr. Analyst - 5-8 years preferredKnowledge Areas: Accounting Customer Service Department Knowledge (processes, procedures, operations, etc.) Project ManagementTechnical Skills: Excel, Access, Word and PowerPoint (advanced proficiency for Senior position)Certifications/Licenses:Project Management (PMP) certification a plusIndividual Competencies:Demonstrates Self-Awareness Problem Solving Action-Oriented Collaborates Communicates Effectively This is not necessarily an exhaustive list of all responsibilities, duties, performance standards or requirements, efforts, skills or working conditions associated with the job. While this is intended to be an accurate reflection of the current job, management reserves the right to revise the job or to require that other or different tasks be performed when circumstances change (e.g. emergencies, rush jobs, change in workload or technological developments). The Federal Reserve Bank of Atlanta is an equal opportunity employer.","https://www.glassdoor.com/partner/jobListing.htm?pos=102&ao=295869&s=149&guid=0000016770013c4293a5e399b8533a7a&src=GD_JOB_AD&t=SRFJ&extid=4&exst=OL&ist=&ast=OL&vt=w&slr=true&rtp=0&cs=1_6e44b8b5&cb=1543772389009&jobListingId=3042963373"
"Implementation Consultant","Accruent","New Orleans","LA","$48k-$78k(Glassdoor Est.)"," We are searching for an expert Implementation Consultant (IC) to serve as the ""face"" of Maintenance Connection's virtual company. This position requires the ability to interpret large scale customer requirements and translate them into a successful implementation of our Computerized Maintenance Management System (CMMS). The ideal candidate will have experience implementing CMMS, EAM, or other similar business applications and be willing to travel nationwide.  RESPONSIBILITIES & REQUIREMENTS: Delivering at least 60-70% billable hoursRoad warrior willing to travel (up to 90%) of the time for in-person customer visitsCommitted to being a product expert and using best practice to achieve customer goalsProven ability to successfully manage and balance multiple projects (typically 10-20 active)Self-motivated learning style with a drive for consistent improvementAbility to design an efficient software use process to maximize the ROI for our productExperience leading customer implementations (10 to 50+ days) from kick-off to go liveCore and transactional data migration including mapping, import, and error/warning analysisTraining small to large (typically Building documentation for agendas, project progress, action items, process flow, and guidesMust live within 45 minutes of a major international airport PREFERRED: Technical scoping including integrations and user interface customizationAdvanced report design and configuration with MC's proprietary report generatorWorking knowledge of SQL scripting and HTMLExperience with physical maintenance, preventive schedules, or inventory managementProject Management Professional (PMP) Certification is a plus We are eager to hire a candidate located in California, Utah, Colorado, or Minnesota for this position. We are anxious to find an individual with the requisite skills, enthusiasm and commitment to service excellence. Following a formal review of your resume, you may be requested to document explanations for the above requirements, as well as, produce sample work from prior positions. We look forward to hearing from you and will follow up with you directly regarding the opportunity for an interview. All applicants will be notified if/when the position is filled. ABOUT MAINTENANCE CONNECTION: Maintenance Connection provides Facility Maintenance and Asset Management Software to organizations worldwide. Our unique blend of technology and personalized service is a critical component of our client satisfaction. Our attention to service is evident in the people we hire, the systems we develop and the way we interact with our clients. We prioritize giving back and believe our big mission is to make a positive impact in the world through our software and the lives we touch every day. For more information, please visit www.mcgivesback.com and www.maintenanceconnection.com.All offers of employment are made contingent upon the successful completion of a background check. A background check may include: verification of education, past employment, criminal background reports, motor vehicle driving records, reference checks, civil suit records, drug test and/or investigations into incidents involving theft, fraud, harassment and workplace violence. The company is the sole determinant of a successful background check.","https://www.glassdoor.com/partner/jobListing.htm?pos=101&ao=372478&s=58&guid=0000016770013c42b47dfe3c30dad90f&src=GD_JOB_AD&t=SR&extid=1&exst=OL&ist=&ast=OL&vt=w&slr=true&rtp=0&cs=1_3a59c43e&cb=1543772389011&jobListingId=3011099533"
"Entry Level Business Analyst","Staffigo Technical Services, LLC","New Orleans","LA","","Responsibilities:Skilled at researching, collecting, manipulating, and analyzing medium to large and complex problems, requirements, process flows and data sets.Ability to organize data, information, processes, and establish priorities; must be detail-oriented.Excellent verbal and written communication skills The BA must facilitate working meetings, ask good questions, listen to the answers, and understand whats being said, document understanding in the form of requirements (user stories) and record sign-offs from stakeholders.Critical thinking and problem-solving skills The BA shall facilitate a shared understanding of the problem, determine the scope of the project, come-up with possible solutions, document pros and cons of each solution, and recommend solutions which are easy to implement, cost-effective and acceptable to the end users & stakeholders.Highly professional with a strong outcome and customer centric approach, commitment to meeting deadlines, highly responsive, and ability to multitask in a fast-paced, dynamic global environment.Comfortable working collaboratively with individuals of varying roles & background.Proactive, out of the box thinker, self-starter with an ability to network and collaborate with other team members, stakeholders, and cross-functional teams.Willing to question assumptions, status-quo and propose alternative ideas & solutions.Desired ExperienceAbility to work effectively with cross functional departmentsDetail and process orientedFlexible and adaptable to changeSelf-motivated and possesses the ability to complete tasks on time and with little supervisionVery good problem solving skillsMust have above average written, verbal communication skillsExcellent organizational skills","https://www.glassdoor.com/partner/jobListing.htm?pos=102&ao=4341&s=58&guid=0000016770013c42b47dfe3c30dad90f&src=GD_JOB_AD&t=SR&extid=1&exst=OL&ist=&ast=OL&vt=w&slr=true&rtp=0&aa=1&ea=1&cs=1_a75e8b5a&cb=1543772389012&jobListingId=2783849390"
"Business Analyst","GCR, Inc.","New Orleans","LA","$52k-$85k(Glassdoor Est.)"," GCR Inc. (GCR) is a leading software development company that serves public sector clients through aviation, government, energy technologies, real estate, community planning, and recovery services.  We are growing and have an immediate need for a Business Analyst to join our team in our Washington DC office. Business Analyst General Responsibilities:Lead the analysis effort with clients on custom software development projectsAnalyze and formulate solutions to business problemsBuild software prototypes and/or screen wireframesWrite functional and technical specifications for DevelopersPresent the results of analysis, application functionality, and solution design to clientsWork with the QA team to develop a testing strategy and test plansShow initiative and speak up; successfully present to groups of people without stage frightChallenge the status quo; dont just accept what is presentedOperate independently in a fast paced and demanding work environment where strong organization and multi-tasking skills are requiredRequired Skills, Qualifications, and ExperienceExperience authoring software requirements and specifications documents such as Business Requirements Documents (BRD), Functional Specifications Documents (FSD), etc.Must have experience with software that requires major customization- not just changes to a canned product such as large ERP systems, for example.Worked on projects where client is completely external to the organization and the only corporate relationship with the client is through a contractExperience working directly with external clients under contract, particularly fixed-price/fixed-scopeProven work experience as a Business Analyst for custom software implementations, preferably with state government agenciesMust have managed User Acceptance Testing and taken a system liveExperience adhering to written contracts between the company and the clientExcellent client-facing and internal written and verbal communication skillsSolid organizational skills with attention to detail and multi-tasking skills5+ years of experience in business analysis, technical writing or solution design requiredExcellent verbal/written communications and presentation skills requiredExperience in consulting with clients on custom software development projects requiredExceptional analytical and problem solving skillsAbility to create project plans to communicate business analysis approach, deliverables, and estimatesExperience in presenting the results of analysis and application functionality to clientsLeadership skills, business acumen and ability to demonstrate to clients a complete command and understanding of the business needs, problems, issues, and prioritiesProficient in Microsoft applications including Word, Visio, Excel, ProjectMust be adaptable, flexible, and creative. Must be able to visualize and communicate the end vision.Not just track tasks from a high level but get down in the details, understand the problems, and come up with solutionsBachelors Degree in a technical fieldMust be willing and able to travel up to 50%Aviation and FAA experience a must. GCR Inc. offers our employees a competitive compensation package. Among the benefits are paid time off, paid holidays, company matching 401(k), health and dental plans, company paid short term disability and life insurance.  GCR Inc.'s corporate headquarters are in New Orleans, Louisiana with additional offices in Covington, LA., Baton Rouge, LA, Windsor, CT and Indianapolis, IN. GCR Inc. provides equal employment opportunities (EEO) to all employees and applicants for employment without regard to race, color, religion, sex, national origin, age, disability or genetics. In addition to federal law requirements, GCR Inc. complies with applicable state and local laws governing nondiscrimination in employment in every location in which the company has facilities. This policy applies to all terms and conditions of employment, including recruiting, hiring, placement, promotion, termination, layoff, recall, transfer, leaves of absence, compensation and training.GCR Inc. expressly prohibits any form of workplace harassment based on race, color, religion, gender, sexual orientation, gender identity or expression, national origin, age, genetic information, disability, or veteran status. Improper interference with the ability of GCR Inc.'s employees to perform their job duties may result in discipline up to and including discharge.","https://www.glassdoor.com/partner/jobListing.htm?pos=103&ao=4348&s=58&guid=0000016770013c42b47dfe3c30dad90f&src=GD_JOB_AD&t=SR&extid=1&exst=OL&ist=&ast=OL&vt=w&slr=true&rtp=0&aa=1&ea=1&cs=1_711ae81c&cb=1543772389013&jobListingId=3004698358"
