"Name","Company","City","State","Salary","Description","Url"
"Sr Production Control Analyst","Textron","New Orleans","LA","$87k-$133k(Glassdoor Est.)","Sr Production Control AnalystBusiness Name: Textron Systems / Textron Marine & Land Systems Function: Manufacturing Reports to: Manager Prod Control & LogisticsJob Summary: A Senior Production Control Analyst ensures that production requirements are met daily through analysis and reporting of production status. The position works with the management team to ensure that deadlines and schedules are met preventing line stoppages and delays. Responsibilities: •Analyze cost and schedule performance and prepares discrepancy reports detailing cost and schedule variances. •Plan, review and maintain production to include supporting and facilitating production teams to meet daily production requirements. •Evaluate and review production output to provide management with daily analysis and reporting of production status. •Recommend corrective action needed to maintain production schedule.  •Establish and coordinate production schedules. Work closely with other departments, (ie, Supply Management, Production, & Warehouse) to manage the product flow to meet deadlines and prevent line stoppages and delays. •Issue, research and close work orders as required. •Ensure that required parts or assemblies reach the installation point at the proper time in the proper sequence and in sufficient quantity, in keeping with the schedule. •Serve as lead for the Production Control Analyst teams. •Act as subject matter expert for problem resolution relating to material expediting issues. •Assess and determine reasons for delays in delivery of parts and recommends corrective action.•Execute lead activities such as work delegation, development and execution of training, define group procedures, and participate in audits or reviews.•Participate and present production and schedule status in meetings to management and customer.Performs other job-related duties as assigned by managementEducation: Bachelor’s degree in Industrial Engineering, Manufacturing Engineering, Mechanical Engineering, Supply Chain, or related field. Preferred Master’s degree in Supply Chain, Industrial Engineering, or Business Administration. Position Requirements: •Seven plus years of production control/planning or scheduling, manufacturing or inventory/warehousing control experience. •Working knowledge and understanding of fabrication processes with ability to formulate fabrication sequences and instructions from engineering data. •Strong written and verbal communications skills required. •Self starter with ability to work in a fast paced deadline driven environment. •Demonstrated ability to plan, organize and manage multiple priorities efficiently (able to multi-task) to meet changing deadlines. •Demonstrated knowledge and understanding of multi-level Bill of Material Structure. •Proficient in MS Office software (i.e. Word, Excel, etc.). •Demonstrated analytical and attention to detail skills. •Working knowledge of Primavera Scheduling (P6) and Huron systems a plus. License and Certification Requirements:  none","https://www.glassdoor.com/partner/jobListing.htm?pos=221&ao=3839&s=58&guid=0000016770026bac99b79dd2a82fa379&src=GD_JOB_AD&t=SR&extid=1&exst=OL&ist=&ast=OL&vt=w&slr=true&rtp=0&cs=1_7efca4eb&cb=1543772466643&jobListingId=2997769494"
"2019 Intern - Configuration Analyst","Textron","New Orleans","LA","$42k-$65k(Glassdoor Est.)"," About Textron Systems: Harnessing agility and a broad base of expertise, Textron Systems' innovative businesses design, manufacture, field and support comprehensive solutions that expand customer capabilities and deliver value. Textron Systems' businesses are industry-leading developers and integrators of unmanned systems, advanced marine craft, armored vehicles, intelligent battlefield and surveillance systems, geospatial management and analysis systems, intelligence software solutions, precision weapons, piston engines, test and training systems, and total lifecycle sustainment and operational services.  About Textron: Textron is home to globally-recognized businesses, organized within five segments: Bell, Textron Aviation, Industrial, Textron Systems and Finance. Our businesses produce hundreds of products for customers around the world, in a range of industries spanning aerospace and defense, specialized vehicles, turf care, fuel systems, and tools and test equipment. The company continually invests in next-generation products and services designed to win in the marketplace. Job Summary: The Configuration Analyst Intern will work under the supervision of the Configuration/Data Management Manager to perform configuration/data management activities to support project and organizational needs. Responsibilities:Maintain, retrieve and file configuration and data management items for new and legacy data using configuration management systems such as EPDM and SharePoint.Assign identification numbers and release configuration items.Capture records and create reports.Store, protect, input and retrieve data.Process data requests.Support contract and subcontract deliverables (CDRL/SDRL).Assist with the Configuration Control Board (CCB) meetings.Perform other job responsibilities as assigned by management.Education Progress towards Bachelor's Degree in Systems Engineering, Engineering, Business or related field. Position Requirements:Working knowledge of configuration/data management.Familiarity of change management processes such as Engineering Change Request (ECR), Engineering Change Proposal (ECP) and Engineering Change Notice (ECN).Working knowledge of SharePoint, Solid Works, EPDM or similar tools.Ability to interact effectively across all levels of the organization.Excellent communication skills, both oral and written.Proficient in Microsoft Office applications including Excel, Outlook and Word.Working knowledge of Microsoft Office products including PowerPoint and Project.SDL2017","https://www.glassdoor.com/partner/jobListing.htm?pos=222&ao=283198&s=58&guid=0000016770026bac99b79dd2a82fa379&src=GD_JOB_AD&t=SR&extid=1&exst=OL&ist=&ast=OL&vt=w&slr=true&rtp=0&cs=1_596f2194&cb=1543772466645&jobListingId=3025284187"
"REMOTE EPIC IDENTITY ANALYST","CTG","New Orleans","LA",""," Title: REMOTE EPIC IDENTITY ANALYST  Location: United States  Job Number: 18212437  CTG is seeking experienced Epic Identity Analysts for a midterm opportunity in the South region. This position is 6 months and is a remote position. Responsibilities:Analysts will be focused on build and workflow efforts.Build within the Epic Identity module, attend meetings, and meet with upper management/business owners.The consultant will be expected to come in as an expert and conduct analysis as well as build and testing within the system.Understanding of hospital operations and workflows, including HIM, data integrity, EMPI conversion.Knowledge of best practices and how each area integrates with othersSolves complex problems and takes a new perspective on existing solutions; exercises judgment based on the analysis of multiple sources of informationAbility to interact effectively with peers, management, physician office staff, vendors, and other customersEffective organization skills and attention to detail; effective follow-through, and commitment to excellenceAbility to hear and communicate with others in a clear, understandable, and professional manner.Demonstrated use of good written and verbal communication skillsExcellent time management skillsStrong analytical and multi-tasking skillsExperience participating in optimization projects including design, build, testing, and supportMust have strong Identity build and EMPI conversion experience.Must be current with NVTs for Identity.HIM certification and build strongly preferred.Must have at least 3-5 years recent Epic build experience in Identity application For immediate consideration, please send your resume to Holly.Christian@CTG.com Qualifications: CTG (NASDAQ: CTG) provides industry-specific IT services and solutions that address the business needs and challenges of clients in high-growth industries in North America and Western Europe. CTG also provides strategic staffing services for major technology companies and large corporations. Backed by more than 50 years of experience and proprietary methodologies, CTG has a proven track record of reliably delivering high-value, industry-specific staffing services and solutions to its clients. CTG has operations in North America, Western Europe, and India.  CTG's greatest asset is its people, and as such, we are committed to providing employees programs and processes to support their performance, hone their skills, and advance in their careers. This commitment is reflected by CTG being named a Best Places to Work in Healthcare company by Modern Healthcare (2013-2016) in North America, and a Best Workplace in the United Kingdom (2013), Belgium (since 2007), and Luxembourg (since 2011).  CTG will consider for employment all qualified applicants including those with criminal histories in a manner consistent with the requirements of all applicable local, state, and federal laws.  CTG is an Equal Opportunity/Affirmative Action Employer and strong advocate of workforce diversity. Minority/Female/Sexual Orientation/Gender Identity/Disability/Veteran.  Job: Healthcare & Hospital Implementations","https://www.glassdoor.com/partner/jobListing.htm?pos=223&ao=400784&s=58&guid=0000016770026bac99b79dd2a82fa379&src=GD_JOB_AD&t=SR&extid=1&exst=OL&ist=&ast=OL&vt=w&slr=true&rtp=0&cs=1_fb8fb21b&cb=1543772466646&jobListingId=3025874786"
"Business Analyst (Consultative Business Sales)","Walker Consulting Services LLC","Metairie","LA",""," THIS IS NOT AN IT POSITION. THIS IS A CONSULTATIVE SALES POSITION.  As a Walker Consulting Services Business Analyst, you will analyze small to medium-sized businesses; determine the financial impact of ownership decision-making, corporate structure, business planning and industry benchmarking. At the conclusion of the analysis, the Business Analyst and the client will decide if it makes sense to move into the implementation phase, utilizing the resources of our Consulting Services Division. Analysts are given the tools and trained in the skills necessary to accomplish this task. However, successful analysts have attributes that cannot be taught. They are strong, dynamic, confident teachers, communicators and leaders with exceptional understanding and empathy.  Job Types: Full-time, Contract  Experience: Business Analyst: 5 years (Preferred) Education: Bachelor's (Required) Work authorization: United States (Required)","https://www.glassdoor.com/partner/jobListing.htm?pos=224&ao=389273&s=58&guid=0000016770026bac99b79dd2a82fa379&src=GD_JOB_AD&t=SR&extid=1&exst=OL&ist=&ast=OL&vt=w&slr=true&rtp=0&cs=1_da1f0eb6&cb=1543772466647&jobListingId=3033252984"
"35225 Manager (Sr SAP Controls Analyst)","ABBTECH Professional Resources, Inc.","New Orleans","LA",""," **Job Description:**Provide enhancements to the government grants management portal+ Education/Certification Requirement+ Client Background Required+ Fingerprinting Required**Required Skills:**+ Understanding of SAP applications, authorization concept, and technical architecture+ Knowledge of SAP IT General Controls+ Knowledge of SAP business process controls+ Understanding of IT risk assessments, and controls definition**Desired Skills:**+ Understanding of NIST as it relates to SAP application controls**Responsibilities:**+ Perform process walkthroughs with business process analysts, and domain subject matter experts. Identify risks within the SAP landscape as they relate to the client's business, and identify controls to mitigate those risks.**Deliverables:**+ List of risks, processes, sub-processes, suggested controls, and implementation recommendations**Clearance: Public Trust****ABBTECH is an EOE/Minorities/Women/Disabled Individuals/Veterans**","https://www.glassdoor.com/partner/jobListing.htm?pos=225&ao=400784&s=58&guid=0000016770026bac99b79dd2a82fa379&src=GD_JOB_AD&t=SR&extid=1&exst=OL&ist=&ast=OL&vt=w&slr=true&rtp=0&cs=1_5d10c9d8&cb=1543772466648&jobListingId=3042851913"
"Industry X - OT Cybersecurity Analyst","Accenture","New Orleans","LA","","Job descriptionThe digital revolution is changing everything. It’s everywhere – transforming how we work and play. Are you reacting to the disruption each day or are you leading the way as a digital disrupter? Accenture Digital is driving these exciting changes and bringing them to life across 40 industries in more than 120 countries. At the forefront of digital, you’ll create it, own it and make it a reality for clients looking to better serve their connected customers and operate always-on enterprises. Join us and become an integral part of our experienced digital team with the credibility, expertise and insight clients depend on. Industry X.0 A new area within Accenture Digital is Industry X.0, an advanced, digitally enabled, innovative, planning and investment approach for manufacturing and asset-intensive industries.  In your role within our Industry X.0 team, you’ll help clients take advantage of significant market opportunities as digital technology moves into the core of industry in product development and manufacturing environments. You’ll help them transform their product, manufacturing and product related services value chains in Products, Communications, Media, High Tech, Aerospace & Defense, Chemicals, Mining, Oil & Gas and Utilities. As part of Accenture Digital, you’ll benefit from tailored career management and specialist skills that will fuel your ambitions in the Industry X.0 space. Job Description Our cybersecurity teams help clients identify and evaluate security gaps, subsequently driving the implementation of solutions to mitigate security exposure. They possess relevant cybersecurity technical skills through continuous research of the latest security vulnerabilities, threats, capabilities, and mitigation techniques. They are expected to anticipate security requirements, analyze and understand the client security posture and formulate right-sized solutions based on industry leading practices.  Responsible for the completion of all project requirements, including, but not limited to: Delivery of Accenture's Security offerings related to cybersecurity with a focus on security program planning, cyber-risk assessments, and implementation of programs and solutionsManaging and leading large-scale complex cybersecurity engagements with resources distributed globallyCoaching and developing teams of managers, consultants and security analystsWorking directly with clients and Accenture teams to design and implement program strategies for cybersecurity, including data protection, vulnerability management, security incident and event management, and identity management, among othersAnalyzing client’s security posture to creating current state assessment, gap analyses, and strategic implementation roadmapsPerforming requirements analysis and developing strategies and solutions for cybersecurity, risk, and information governancePerforming risk remediation cost-benefit-analysis for a variety of solutionsEstablishing return on investment and business process improvements for investments in cybersecurity programs and technologiesDeveloping and integrating cybersecurity metrics and reporting programs for key security, privacy, risk, compliance, and service continuity indicatorsTranslating technical requirements into business terms for executive stakeholdersTravel Required. + Basic qualificationsYOUR EXPERIENCE: Basic Qualifications3-5 years’ Cybersecurity with Networking in SCADA or Industrial Automation Control Systems (IACS).Networking knowledge and experience with TCP/IP, Wifi, EthernetSET YOURSELF APART: Preferred SkillsSecurity certifications such as CISSP, CISA, GICSP, GIAC, CISMKnowledge and experience with DCS, PLC, HMI, MES, Historians, or other OT systems.Bachelor's Degree APPLY SAVE THIS JOBShare","https://www.glassdoor.com/partner/jobListing.htm?pos=226&ao=4120&s=58&guid=0000016770026bac99b79dd2a82fa379&src=GD_JOB_AD&t=SR&extid=1&exst=OL&ist=&ast=OL&vt=w&slr=true&rtp=0&cs=1_f5091c65&cb=1543772466649&jobListingId=3027487507"
"Sr systems Analyst -","Pan-American Life Insurance Company","New Orleans","LA","$53k-$101k(Glassdoor Est.)"," Summary: Bilingual (Spanish/English) required  The Senior IT Systems Analyst of the IT International Life Team is responsible for the support and development on the policy and administration systems (VidaFlex and Traditional) as well as the LifeDirect web portal. This role acts as the bridge between LATAM/Caribbean Operations Teams, BIS Analysts and the Development staff in IT. Systems Analysts perform technical system design, manage and perform testing and facilitate prioritization of development efforts. Job Duties to include the following: § Works with business analysts and stakeholders to identify technical requirements. Conducts technical requirements gathering/definition workshops. Works with developers to identify and document project estimates for technical requirements.  § Identifies and documents complex technical requirements appropriate for the associated functional  § Translates complex business requirements into technical and/or non-functional requirements, and supports the creation of business cases.  § Produces complex technical requirements documentation for business cases; presents findings to senior stakeholders.  § Constructs complex data models  § Evaluates and recommends appropriate/optimal project approach according to project need  § Manages the schedule of technical deliverables for projects.  § Works with business analysts and stakeholders to resolve scope issues and other conflicts.  § Produces and executes complex system test scripts such as regression, stress load, performance, integration and functional. Assists in the definition of user acceptance testing.  § Contributes to the development of training and support plans for client's application systems  § Trains, mentors and supports other members of the System Analyst team  § Assists the manager/director in strategic development approaches  § Assists the manager/director with team member development and supervision. Prepares and conducts team members performance evaluations.  § Assigns tasks and prepares personnel activity, project, and program status reports.  § Works with senior business stakeholders to determine business change initiatives.  § Manages relationships with third party suppliers  § Other duties may be assigned Job Requirements to include the following: § Bachelors degree preferred and/or previous work experience in technical positions is mandatory (Computer Science degree preferred)  § 3 to 4 years of experience as a software development team member plus basic IT skills  § Excellent computer skills (Microsoft Office products)  § Excellent oral and written communication skills.  § Able to communicate detail concepts and business risks.  § Must be able to work independently  § Should possess conceptual modeling skills  § Bilingual required (English/Spanish)  We are proud to be an EEO/AA employer M/F/D/V. We maintain a drug-free workplace and perform pre-employment substance abuse testingSDL2017","https://www.glassdoor.com/partner/jobListing.htm?pos=227&ao=189299&s=58&guid=0000016770026bac99b79dd2a82fa379&src=GD_JOB_AD&t=SR&extid=1&exst=OL&ist=&ast=OL&vt=w&slr=true&rtp=0&cs=1_deaa9d0e&cb=1543772466650&jobListingId=3024636710"
"CERNER PATHNET SUPPORT ANALYST","CTG","New Orleans","LA",""," Title: CERNER PATHNET SUPPORT ANALYST  Location: United States  Job Number: 18212769 Seeking a Cerner Millennium PathNet support analyst. Understanding as a Lab tech or operations experience preferred. Responsibilities include all support activities such as incidents, service/change request, routine maintenance. This is a remote position but must be on site for knowledge transfer (3-6 weeks) at the start of project. Support includes being be part of the 24/7 on call rotation. Preferred candidates will have 5 years of Cerner experience, particularly around Cerner Core build and functionality, Careset, order sentence, rule build/maintenance experience with exposure to PathNet/Lab workflow. Microbiology a plus. Exposure to SunQuest Lab system a plus. Candidates should be prepared to be part of a multifunctional team and provide support where needed.  Experience with the detailed design, configuration, build, testing, and troubleshooting experience in one or more of the following Cerner solutions:  ? PowerChart InPatient/Ambulatory CPOE (including, PowerPlans, PowerOrders, Order Sentences, Dynamic Documentation, PowerForms, MPages, Workflow, Task Completion, etc.)  ? Cerner Practice Management  ? Scheduling Management  ? Care Management  ? Core Measures/Quality  ? CareAware, CCL/Clinical Rules  ? Registration  ? PathNet and the Reference Lab Network  ? PharmNet  ? RadNet  ? SurgiNet  ? FirstNet  ? Security Qualifications: CTG (NASDAQ: CTG) provides industry-specific IT services and solutions that address the business needs and challenges of clients in high-growth industries in North America and Western Europe. CTG also provides strategic staffing services for major technology companies and large corporations. Backed by more than 50 years of experience and proprietary methodologies, CTG has a proven track record of reliably delivering high-value, industry-specific staffing services and solutions to its clients. CTG has operations in North America, Western Europe, and India.  CTG's greatest asset is its people, and as such, we are committed to providing employees programs and processes to support their performance, hone their skills, and advance in their careers. This commitment is reflected by CTG being named a Best Places to Work in Healthcare company by Modern Healthcare (2013-2016) in North America, and a Best Workplace in the United Kingdom (2013), Belgium (since 2007), and Luxembourg (since 2011).  CTG will consider for employment all qualified applicants including those with criminal histories in a manner consistent with the requirements of all applicable local, state, and federal laws.  CTG is an Equal Opportunity/Affirmative Action Employer and strong advocate of workforce diversity. Minority/Female/Sexual Orientation/Gender Identity/Disability/Veteran.  Job: Healthcare & Hospital Implementations","https://www.glassdoor.com/partner/jobListing.htm?pos=228&ao=400784&s=58&guid=0000016770026bac99b79dd2a82fa379&src=GD_JOB_AD&t=SR&extid=1&exst=OL&ist=&ast=OL&vt=w&slr=true&rtp=0&cs=1_e10f8f26&cb=1543772466651&jobListingId=3034698691"
