"Name","Company","City","State","Salary","Description","Url"
"actuarial Analyst/Sr actuarial Analyst -","Pan-American Life Insurance Company","New Orleans","LA","$59k-$78k(Glassdoor Est.)"," Summary: Bilingual (English/Spanish)  The Actuarial Analyst / Sr. Actuarial Analyst will be responsible for supporting product development, inforce management, and product support functions by working closely with other members of the department, as well as many other areas of the company. This position will support multiple markets for International Life. There is an expectation to continuously expand actuarial knowledge via work assignments and passing SOA examinations. Credit for at least one SOA exam is required for the Actuarial Analyst position. Credit for multiple SOA exams and actuarial work experience is required for the Sr. Actuarial Analyst position. .Requirements to include the following:Bilingual (English & Spanish).SOA examination credit for at least one exam for Actuarial Analyst.SOA examination credit for at least 4 exams, up to and including ASA level, and at least 2 years of actuarial work experience in individual life required for Sr. Actuarial Analyst.Bachelors degree is required, preferably in Actuarial Science, Mathematics, or Economics.Outstanding mathematical skills.Experience with MS Excel, Word, PowerPoint, and Access.Experience in the life insurance business, especially working with individual life insurance and products, including product and actuarial calculations are a plus.Excellent oral and written communication skills required.Excellent analytical and organizational skills.Must be detail-oriented and have a results-oriented perspective.Job Duties may include the following:Support all areas of the department (product development, product management, and product support) through the departments projects, deliverables, and analyses.Assist in the testing and implementation of product changes and new products in the administrative, illustration, and other systems.Support product development functions including competitive analysis, preparation of product specifications and documentation, product filings, rate review, testing, and product training.Support product management needs including data analysis and report creation, review, and presenting results.Communicate with operational, sales, and IT teams in various markets to offer product support and help with problem-solving.Work with IT areas on problem-solving and testing.Perform some project management functions.May include occasional travel and overnight stay.Delivering all work in line with expectations. In particular, meeting deadlines and ensuring work accuracy.Communicating proactively with others in the department about the work process and results.Creating and maintaining documentation and explaining all inputs and findings.Expanding actuarial knowledge via work assignments and passing of SOA exams.Working as part of a team to find solutions and complete tasks and projects.Review work of others and provide feedback.Other duties as assigned. We are proud to be an EEO/AA employer M/F/D/V. We maintain a drug-free workplace and perform pre-employment substance abuse testing.SDL2017","https://www.glassdoor.com/partner/jobListing.htm?pos=314&ao=189299&s=58&guid=0000016770036792856df60244db8fb0&src=GD_JOB_AD&t=SR&extid=1&exst=OL&ist=&ast=OL&vt=w&slr=true&rtp=0&cs=1_4fff0fa6&cb=1543772531158&jobListingId=3024645021"
"System Senior Financial Analyst","LCMC Health","New Orleans","LA","$69k-$91k(Glassdoor Est.)"," LCMC Health is a Louisiana-based, not-for-profit healthcare system serving the needs of the people of Louisiana, the Gulf South and beyond. LCMC Health currently manages award-winning hospitals including Children#s Hospital New Orleans, Touro, New Orleans East Hospital, West Jefferson Holding, LLC, and University Medical Center New Orleans. LCMC Health supports its outstanding local hospitals as they deliver exceptional, compassionate healthcare to the communities they serve. Please explore our website to learn more about the work we do and our commitment to community-focused healthcare. POSITION SUMMARY: The System Senior Financial Analyst will be responsible for LCMC#s IT financial forecast, annual budgeting process, product costing, operating plan variance analysis, and special projects.# S/he will strategic support to IT Senior Management, including financial presentations, capital expenditure analysis, and other projects requested by Senior Management.# This role acts as the analytical engine of LCMC IT to provide insight and support optimal business decision-making. The System Senior Financial Analyst will provide strategic direction, oversight and support to hospital affiliates, physician groups, and other System entities to develop and deploy an effective Labor Management Program (LMP), which will include productivity, benchmarking, target standards, and position control management. #The LMP will support department labor projects, including action plans, lead activities, and skill mix optimization. JOB DESCRIPTION DISCLAIMER: The above job summary is intended to describe the general nature and level of the work being performed by people assigned to this work.# This is not an exhaustive list of all duties and responsibilities.# LCMC Healthreserves the right to amend and change responsibilities to meet organizational needs as necessary. JOB SPECIFICATIONS: Education: Minimum Required:# Bachelor#s degree in Accounting Preferred:# CPA certification and/or MBA # Experience: Minimum Required:# 5+ years# experience in budgeting and financial planning or equivalent Preferred:# Healthcare experience # License/Certification: Minimum Required:# N/A Preferred:# CPA certification; LEAN certification; Healthcare certifications # Special Skills/Training: Minimum Required:# Advanced knowledge of Excel and PowerPoint; Strong leadership skills; Ability to analyze data and present it in a comprehensive manner; High standards of accuracy and precision; Highly organized; Articulate # both orally and in written communication; Ability to think creatively and problem solve; Self-motivated; Demonstrated ability to work with team members in a hands-on management capacity Preferred:# Prior experience in working with and/or supporting Senior Executives # Reporting Relationships: Does this position formally supervise employees?# No # JOB STANDARDS: # Essential Job Functions Weight # # Essential Job Function #1:# Information Technology Annual Budget 20.0 % Provide support to the Chief Information Officer (CIO) and IT Management Team to create and oversee IT#s annual budget. Analyze current and past trends in key performance indicators, including all areas of revenue, expenses, and capital expenditures. Essential Job Function #2:# Information Technology Monthly Financial Reporting # Variance Analysis 20.0 % Provide support to IT for financial reporting processes. Assist in answering gaps between actual versus budget financial variances. Monitor performance indicators, highlighting trends and analyzing causes of unexpected variances. Analyze complex financial information and reports to provide accurate and timely financial recommendations to management for decision-making purposes. Prepare and present financial information to senior management on a regular basis. Essential Job Function #3:# Information Technology Contract Management # Ad-Hoc Analyses 10.0 % Oversee and manage IT vendor payments according to agreed upon contracts. Prepare ad-hoc financial analysis as requested by LCMC CFO, CIO, and/or IT Management Team. Support senior management with in-depth analysis. Improve performance by evaluating processes to drive efficiencies. Prepare and present financial information to senior management on a regular basis. Provide support to IT management to develop product cost models, e.g. Community Connect pricing. Essential Job Function #4:# Labor Productivity Project Management 20.0 % Introduce Labor Productivity to local Hospital management teams. Participate in Departmental Interviews at local Hospitals. Participate in Hospital Weekly Status Calls. Manage local Hospital Labor Productivity implementation timelines. Participate in training of labor coaches, employees/leaders, and SMEs. Manage initial completion and follow up on Department Profile Questionnaires. Essential Job Function #5:# Labor Productivity System Statistics Standardization # Data Extract Standardization 20.0 % Manage Data Interface Files through collection of historical data and validation (include Epic). Serve as liaison for Department Reporting Q#A. Assist in standardizing Labor Productivity statistics for local Hospitals. Essential Job Function #6:# Labor Productivity Council ## 10.0 % Participate in the creation of local Hospital Labor Council Structures Participate in LCMC Management Council as System Labor Coach # # # # # #LCMC is an equal opportunity employer and all qualified applicants will receive consideration for employment without regard to race, color, religion, sex, national origin, sexual orientation, disability status, protected veteran status, or any other characteristic protected by law.# #SDL2017","https://www.glassdoor.com/partner/jobListing.htm?pos=315&ao=283198&s=58&guid=0000016770036792856df60244db8fb0&src=GD_JOB_AD&t=SR&extid=1&exst=OL&ist=&ast=OL&vt=w&slr=true&rtp=0&cs=1_78937232&cb=1543772531160&jobListingId=3025361807"
"Microsoft Dynamics AX 365 Supply Chain Functional Consultant","Avanade","New Orleans","LA","$71k-$105k(Glassdoor Est.)"," Avanade leads in providing innovative digital services, business solutions and design-led experiences for its clients, delivered through the power of people and the Microsoft ecosystem. Our professionals combine technology, business and industry expertise to build and deploy solutions to realize results for clients and their customers. Avanade has 27,000 digitally connected people across 23 countries, bringing clients the best thinking through a collaborative culture that honors diversity and reflects the communities in which we operate. Majority owned by Accenture, Avanade was founded in 2000 by Accenture LLP and Microsoft Corporation. Learn more at www.avanade.com.  The Avanade Dynamics 365/AX Supply Chain Functional Consultant takes an end-to-end, process-based approach to address key business challenges such as complexity reduction, lean manufacturing and operations excellence, process innovation, strategic cost reduction, enterprise transformation and growth through fast innovation. Functional Consultants are challenged to understand and respond to clients' varied business needs in both the private and public sector, and work with clients to rapidly enhance the internal capabilities needed to continuously improve operational and innovation performance. Our core offerings target different aspects of a client's value chain - both across the enterprise and at the intersections of assets, process, polices, and people delivering value.  Job Description:  As a Functional Consultant in the Avanade Dynamics 365/AX Practice, you will use your strategy and operations consulting skills, business process knowledge, and other methodologies and tools to quantitatively analyze issues and drive solutions to transform our client's business.  Avanade professionals are responsible for delivering large-scale, complex programs that marry processes with technology to help our clients achieve high performance. Dynamics AX professionals design, implement and deploy AX solutions to achieve defined business goals. They maintain skills in AX applications process design and configuration; AX application design, development, integration, testing and deployment; and AX application technical architecture.  Key responsibilities:  Business performance and process diagnostics and assessments  Supervising application design and architecture components  Supervising process and functional design activities  Creating functional requirements as an input to application design  Developing and testing detailed functional designs for business solution components and prototypes  Supervising application build, test, and deploy activities  Planning and executing data conversion activities  Driving test planning and execution  Project and program management that exhibits leadership in process re-engineering and implementation of process, technology, strategy, and organizational change  QualificationsJob Requirements: Configure and implement Supply Chain Dynamics AX/365 for our customersUse your knowledge of business processes and Dynamics AX to identify software gaps and suggest alternativesWrite development specifications and interface with customers to test modifications and resolve any issues that ariseDemonstrate the ability to work systematically and logically to analyze situations, resolve problems, identify causes and anticipate implicationsContribute to the set-up and execution of Dynamics AX project work streamsManage and develop customer relationships and perceptions to achieve mutual goalsDemonstrate the capacity to plan, prioritize and organize their time, project schedules and multiple project activitiesAbility to travel approx. 80% (Typically Mon-Thurs) Minimum Requirements: Bachelors Degree: Business or technology related BA/BSDynamics AX Supply Chain implementation experienceExperience participating in requirements gathering process for IT systemsClear and concise oral and written communicationAbility to lead people, teams and projectsUnderstanding of aspects of business management and strategic evaluation Preferred Requirements: Masters Degree in business or technologyDynamics 365 experienceDynamics AX CertificationPrior consulting experienceWorking knowledge of at least one software development methodologyWorking knowledge of Microsoft platform skillsWorking knowledge of Microsoft Project Professional Skills: Results oriented / self-directed ability to drive change in unstructured environmentStrong client interface and presentation skillsStrong business acumenTrack record of initiative and outstanding performanceExcellent interpersonal skills-'Customer Focus'Manages customer expectations effectivelyAbility to quickly build relationshipsPassion for learningStrong time management skillsRequisition ID - 57813 Avanade is the leading provider of innovative digital and cloud-enabling services, business solutions and design-led experiences, delivered through the power of people and the Microsoft ecosystem. Majority owned by Accenture, Avanade was founded in 2000 by Accenture LLP and Microsoft Corporation and has 30,000 professionals in 24 countries. Visit us at www.avanade.com.","https://www.glassdoor.com/partner/jobListing.htm?pos=316&ao=150272&s=58&guid=0000016770036792856df60244db8fb0&src=GD_JOB_AD&t=SR&extid=1&exst=OL&ist=&ast=OL&vt=w&slr=true&rtp=0&cs=1_97d002bc&cb=1543772531161&jobListingId=3042613502"
"Sr. Trans Freight Sourcing Analyst","Florida Crystals","New Orleans","LA","$59k-$89k(Glassdoor Est.)","ASR Group is the world’s largest refiner and marketer of cane sugar, with an annual production capacity of more than 6 million tons of sugar. The company produces a full line of grocery, industrial, food service and specialty sweetener products. Across North America, ASR Group owns and operates six sugar refineries, located in Louisiana, New York, California, Maryland, Canada and Mexico. In the European Union, the company owns and operates sugar refineries in England, Portugal and Italy. ASR Group also owns and operates mills in Mexico and Belize. The company’s brand portfolio includes the leading brands Domino®, C&H®, Redpath®, Tate & Lyle®, Lyle’s® and Sidul®.OVERVIEWThe Transportation Sourcing Analyst will be responsible to maintain the company’s trucking capacities by week to ensure maximum optimization of all planned truckloads. The analyst will be responsible for all Transportation Management System (TMS) training documentation both internal and external; and will maintain all documents on public websites. Owner of operational reporting including carrier and refinery scorecards. Provide support to Logistics operations manager with sales freight pricing program, and would be lead for spot bidding process. Lead for managing annual and periodic Request For Proposal process. Role KPIs / objectives include: optimized loads per day, KPIs published timely and accurately, sales freight requests response, manual touched tenders, productivity projects - better use of mode and networks to help achieve $1M + in annual freight savingsDETAILED ROLES & RESPONSIBILITIESResponsible for TMS optimization performance, balancing cost and serviceRFP bid preparation, analysis and carrier selectionReduce manual tendering process and auto-tenderLead for managing customer self-service processes on TMSBack-up Chalmette office as needed.Build operational reporting processes aimed at managing business by exception, promoting the use of alertsPromoting the expanded relevant usage of TMS by customer service, planning, and customersWORK EXPERIENCESExcellent interpersonal relationship skills focusing on teamwork and collaboration within all levels of the business.Must be capable of relating data analysis to sound business recommendations, and supporting business case for improvementsExcellent analytical competency with strong quantitative analysis skills. Capable of data mining / data gathering to model complex business situations.Advanced working knowledge of spreadsheets (Excel or equivalent) and database (MS Access or equivalent).Technically inclined to rapidly learn new functionalities of complex information systemsMust have strong analytical skills with keen attention to detail. Hands-on experience with ERP/ Planning Systems required. Proficiency with MS Office a must. Experience with SAP, Sharepoint, SAP Business Objects, project management software a plus.Previous project management and/or project execution experience a plusEDUCATION REQUIREMENTSMinimum of 5+ years’ experience in Supply Chain area (Procurement, Manufacturing, Warehousing / Distribution / Logistics, Planning, Customer Service).BS in Management (Operations / Supply Chain preferred) or Engineering. Master’s degree a plus.Equal Opportunity Employer of Minorities, Females, Protected Veterans and Individuals with Disabilities.","https://www.glassdoor.com/partner/jobListing.htm?pos=317&ao=4127&s=58&guid=0000016770036792856df60244db8fb0&src=GD_JOB_AD&t=SR&extid=1&exst=OL&ist=&ast=OL&vt=w&slr=true&rtp=0&cs=1_ea069f3e&cb=1543772531162&jobListingId=2966917973"
"Sr Production Control Analyst","AAI Corporation","New Orleans","LA","$78k-$120k(Glassdoor Est.)","Sr Production Control AnalystBusiness Name: Textron Systems / Textron Marine & Land Systems Function: Manufacturing Reports to: Manager Prod Control & LogisticsJob Summary: A Senior Production Control Analyst ensures that production requirements are met daily through analysis and reporting of production status. The position works with the management team to ensure that deadlines and schedules are met preventing line stoppages and delays. Responsibilities: •Analyze cost and schedule performance and prepares discrepancy reports detailing cost and schedule variances. •Plan, review and maintain production to include supporting and facilitating production teams to meet daily production requirements. •Evaluate and review production output to provide management with daily analysis and reporting of production status. •Recommend corrective action needed to maintain production schedule.  •Establish and coordinate production schedules. Work closely with other departments, (ie, Supply Management, Production, & Warehouse) to manage the product flow to meet deadlines and prevent line stoppages and delays. •Issue, research and close work orders as required. •Ensure that required parts or assemblies reach the installation point at the proper time in the proper sequence and in sufficient quantity, in keeping with the schedule. •Serve as lead for the Production Control Analyst teams. •Act as subject matter expert for problem resolution relating to material expediting issues. •Assess and determine reasons for delays in delivery of parts and recommends corrective action.•Execute lead activities such as work delegation, development and execution of training, define group procedures, and participate in audits or reviews.•Participate and present production and schedule status in meetings to management and customer.Performs other job-related duties as assigned by managementEducation: Bachelor’s degree in Industrial Engineering, Manufacturing Engineering, Mechanical Engineering, Supply Chain, or related field. Preferred Master’s degree in Supply Chain, Industrial Engineering, or Business Administration. Position Requirements: •Seven plus years of production control/planning or scheduling, manufacturing or inventory/warehousing control experience. •Working knowledge and understanding of fabrication processes with ability to formulate fabrication sequences and instructions from engineering data. •Strong written and verbal communications skills required. •Self starter with ability to work in a fast paced deadline driven environment. •Demonstrated ability to plan, organize and manage multiple priorities efficiently (able to multi-task) to meet changing deadlines. •Demonstrated knowledge and understanding of multi-level Bill of Material Structure. •Proficient in MS Office software (i.e. Word, Excel, etc.). •Demonstrated analytical and attention to detail skills. •Working knowledge of Primavera Scheduling (P6) and Huron systems a plus. License and Certification Requirements:  none","https://www.glassdoor.com/partner/jobListing.htm?pos=318&ao=3839&s=58&guid=0000016770036792856df60244db8fb0&src=GD_JOB_AD&t=SR&extid=1&exst=OL&ist=&ast=OL&vt=w&slr=true&rtp=0&cs=1_7136993d&cb=1543772531164&jobListingId=2997556086"
"ANALYST OR SENIOR ANAYLST (DOE)","Pan-American Life Insurance Group","New Orleans","LA","","Summary: Bilingual preferred (Spanish/English)The Business Continuity Analyst reports to the 2nd VP Corporate Administration. This role requires a significant understanding of business continuity planning methodologies and support of critical business operations. The business continuity analyst will assist in maintaining and improving the business continuity program to improve resiliency and protect the Company’s brand and reputation. The business continuity analyst will support preparation for and response to actual emergencies Job Duties to include the following: Work closely with the 2nd VP of Corporate Administration as well as Business Leadership on significant projects that affect resiliency of critical business processes.· Responsible for supporting the administration of global business continuity program, including:· Ensure that Business Continuity program components (Business Impact Analysis, Risk Assessments, plans, strategies, etc.) are current, effective, and address business requirements.· Develop schedules and materials for Business Continuity training/awareness activities to ensure that business continuity teams are trained and proficient in implementing the business continuity plans.· Coordinate business recovery exercises (Walk-throughs, Recovery Center, Remote, etc).· Administer and manage content on the Business Continuity.· Manage emergency communications with employees, Administer emergency communications tools.· Ensure that new acquisitions are integrated into business continuity management program.· Support the Crisis Management Team to include: scheduling conference calls, supporting emergency communications, preparing and distributing status updates, guiding decision-making, ensuring execution of action items, and creating post-incident reports.· Support business continuity related initiatives, strategy development, in-house training· On call monitoring of global events.· Other activities as required.Job Requirements to include the following:· Bachelor’s degree· Knowledge or experience in business continuity planning - commensurate with 3-5 years of experience.· Prior business continuity experience at a large organization or business continuity consulting experience.· Experience in managing disruptive incidents (significant, multi-site incidents would be a strong plus).· An understanding of Information Technology concepts.· Proficient in Microsoft Office suite of applications (Word, Excel, PowerPoint, Access, SharePoint, etc.).· Excellent verbal, written and presentation skills· Very strong analytical skills.· Must be able to interact and work efficiently and effectively with employees across the organization.· Strong administrative skills, including effectiveness in developing project plans to achieve target dates.· Ability to be on call to support off-hours emergencies.· Able to travel (domestically and internationally) (5%-10%).· Must be a productive team player and must also be comfortable working independently, with little direct supervision.· Bilingual (English/Spanish) is a plus","https://www.glassdoor.com/partner/jobListing.htm?pos=319&ao=4132&s=58&guid=0000016770036792856df60244db8fb0&src=GD_JOB_AD&t=SR&extid=1&exst=OL&ist=&ast=OL&vt=w&slr=true&rtp=0&cs=1_8e684f76&cb=1543772531216&jobListingId=2559033833"
